filename,text
peterattiamd.com_category_risks_heart-disease-prevention.json,"Heart Disease Prevention | Peter Attia Cardiovascular Disease #203 – AMA #34: What Causes Heart Disease? Could plasma protein levels be a surrogate for VO2 max testing as a measure of cardiorespiratory fitness? Coronary atherosclerosis is a silent killer, but we have tools to stop it #313 – AMA #62: Protein’s impact on appetite and weight management, and uric acid’s link to disease and how to manage levels #311 ‒ Longevity 101: a foundational guide to Peter’s frameworks for longevity, and understanding CVD, cancer, neurodegenerative disease, nutrition, exercise, sleep, and more Does pharmacological treatment for ADHD increase risk of cardiovascular disease? Does xylitol increase risk of cardiovascular disease? #306 – AMA #60: preventing cognitive decline, nutrition myths, lowering blood glucose, apoB, and blood pressure, and more Reducing heavy alcohol intake: a lifeline for cardiovascular health High Lp(a) warrants intervention, even without other cardiovascular risk factors Silencing the alarm over a recent paper on dietary protein and atherosclerosis Comment policy Sign up to receive the 5 tactics in my Longevity Toolkit, followed by non-lame, weekly emails on the latest strategies and tactics for increasing your lifespan, healthspan, and well-being (plus new podcast announcements). Introduction to My Longevity Tactics One of the scariest things about heart disease is that it is often a silent killer, with few to no outward symptoms. As one of my medical school professors liked to point out, the most common “presentation” of the disease is a sudden, fatal heart attack. You know the patient has heart disease because he has just died from it. And while mortality rates from those first, surprise heart attacks have dropped significantly thanks to improvements in basic cardiac life support and time-sensitive interventions, such attacks are still fatal roughly 1/3 of the time. Below is a collection of past articles and podcasts related to heart disease prevention, atherosclerosis, coronary disease,cholesterol, apoB, and more. “Not everybody dies from atherosclerosis, but… everybody dies with it.” — Peter Attia A proteomics model may provide an alternative method for estimating risk of mortality and chronic disease A new study reveals that the prevalence of atherosclerosis is alarmingly high among asymptomatic adults classified as “low risk” and underscores the importance of lipid-lowering therapies for avoiding atherosclerosis progression and mortality “The body responds in pretty significant ways to alterations in protein availability.” —Peter Attia “I would say three-quarters of the benefits you can get towards a longer life, come solely from pursuing better health.” —Peter Attia A recent study suggests that use of medications commonly prescribed for ADHD treatment is associated with increased risk of certain cardiovascular conditions, but does it exceed the risks associated with untreated ADHD? Same study, different day: A recent study linking the sweetener xylitol to increased risk of cardiovascular events should ring a bell – but not an alarm. Δ “Metabolic health, first and foremost, is the goal of nutrition.” —Peter Attia Can reducing heavy alcohol intake significantly lower cardiovascular risk, or is the damage already done? A new study shows that the oft-ignored metric is strongly associated with heart attacks, regardless of the presence or absence of standard modifiable risk factors for cardiovascular disease A recent report that high protein intake contributes to atherosclerosis has limited relevance to anyone but transgenic mice Peter Attia is a physician focusing on the applied science of longevity. Δ Content Peter Connect Copyright © 2012–2024 PA IP, LLC. All rights reserved.This site is protected by reCAPTCHA and the GooglePrivacy PolicyandTerms of Serviceapply. Privacy Policy|Terms of Use|Do Not Share My Personal Information Login Sign-up (free) to receive the5 Tactics in my Longevity Toolkitdelivered by email as a 5-day course. Non-lame, weekly emails on the latest strategies and tactics for increasing your lifespan, healthspan, and well-being (plus new podcast announcements). Δ"
peterattiamd.com_contact_media-inquiries.json,"Speaking & Media Inquiries - Peter Attia Speaking & Media Inquiries Comment policy Introduction to My Longevity Tactics Δ Peter Attia is a physician focusing on the applied science of longevity. Δ Content Peter Connect Copyright © 2012–2024 PA IP, LLC. All rights reserved.This site is protected by reCAPTCHA and the GooglePrivacy PolicyandTerms of Serviceapply. Privacy Policy|Terms of Use|Do Not Share My Personal Information Login Sign-up (free) to receive the5 Tactics in my Longevity Toolkitdelivered by email as a 5-day course. Non-lame, weekly emails on the latest strategies and tactics for increasing your lifespan, healthspan, and well-being (plus new podcast announcements). Δ"
peterattiamd.com_disclosures.json,"Disclosures - Peter Attia Disclosures Comment policy Companies I have invested in Companies I advise Do you participate in affiliate marketing? Are you compensated for product endorsements? Do you allow your name or image to be used by others? Do you sell ads to support your podcast? Introduction to My Longevity Tactics It is very important to me, as it has been from the moment I became a public figure, that all my potential conflicts are disclosed. I believe this is a practice that every person who is in a position of influence should adhere to, though sadly most do not. I list my disclosures in two groups, with some overlap: (i) companies I have invested in, and (ii) companies I am currently advising or have previously advised. (Note: this list does not include investments in companies that have no involvement whatsoever in my sphere of influence or line of work.) Present: Previous: This list is updated regularly. In addition to providing this list, I’d like to address a few questions you may be reasonably asking. No, I do not engage in any affiliate (i.e., kickback) marketing. Under no circumstance have I ever or will I ever receive a direct financial kickback or “affiliate” payment for any product I discuss. Most of the time when I discuss a product that I have purchased, like, and use I have no association with the company. Instead, it is a genuine unprompted endorsement as I do not accept or invite ‘free products’ in exchange for reviews. And, again, I receive no kickback, if/even when it is offered following an unannounced endorsement. No, I do not accept compensation for product endorsement. Other times, I will talk about a product or service produced by a company in one of the two categories above. I still, under no circumstance, am separately compensated to do so, nor do I have commercial or contractual obligations to do so at my insistence. This includes declining any compensation that would create an incentive to be a “paid face” of an organization or brand. Yes, but under very limited circumstances. I do not allow third-party ads using my name, image, brand and likeness I do not authorize or lend my name, image, brand, or likeness without explicit consent. My team is rigorous in pursuing legal action when we notice folks falsely using my name or my endorsement to directly promote sales via online ads. If you see anyone doing this, pleasecontact usand let us know. No, my podcast is Ad-free The only revenue generated from the podcast comes in the form of subscription via our members who receive additional benefits, beyond the free podcast, by subscribing. More on this can be foundhere. Peter Attia is a physician focusing on the applied science of longevity. Δ Content Peter Connect Copyright © 2012–2024 PA IP, LLC. All rights reserved.This site is protected by reCAPTCHA and the GooglePrivacy PolicyandTerms of Serviceapply. Privacy Policy|Terms of Use|Do Not Share My Personal Information Login Sign-up (free) to receive the5 Tactics in my Longevity Toolkitdelivered by email as a 5-day course. Non-lame, weekly emails on the latest strategies and tactics for increasing your lifespan, healthspan, and well-being (plus new podcast announcements). Δ"
peterattiamd.com_gift-membership.json,"Gift Membership - Peter Attia Gift Membership Interested in Premium Membership? Comment policy Introduction to My Longevity Tactics Please enter the buyer’s information below.You will have the option to enter the recipient’s information after payment, along with a gift message. Exciting news!We’re rolling out a new website design today, bringing you a sleek, upgraded experience with your premium membership. During this transition, we’ve temporarily paused new membership sign-ups, but don’t worry—justenter your email below, and we’ll notify you as soon as membership activation is available,later today or tomorrow morning. Δ Peter Attia is a physician focusing on the applied science of longevity. Δ Content Peter Connect Copyright © 2012–2024 PA IP, LLC. All rights reserved.This site is protected by reCAPTCHA and the GooglePrivacy PolicyandTerms of Serviceapply. Privacy Policy|Terms of Use|Do Not Share My Personal Information Login Sign-up (free) to receive the5 Tactics in my Longevity Toolkitdelivered by email as a 5-day course. Non-lame, weekly emails on the latest strategies and tactics for increasing your lifespan, healthspan, and well-being (plus new podcast announcements). Δ"
peterattiamd.com_login.json,"Login - Peter Attia Login Comment policy Request a Password Reset Request a Password Reset Introduction to My Longevity Tactics Peter Attia is a physician focusing on the applied science of longevity. Δ Content Peter Connect Copyright © 2012–2024 PA IP, LLC. All rights reserved.This site is protected by reCAPTCHA and the GooglePrivacy PolicyandTerms of Serviceapply. Privacy Policy|Terms of Use|Do Not Share My Personal Information Login Sign-up (free) to receive the5 Tactics in my Longevity Toolkitdelivered by email as a 5-day course. Non-lame, weekly emails on the latest strategies and tactics for increasing your lifespan, healthspan, and well-being (plus new podcast announcements). Δ"
peterattiamd.com_media.json,"Media Appearances - Peter Attia Media Appearances Most popular Podcasts Talks Articles Other appearances Publications Comment policy Introduction to My Longevity Tactics For media inquiries, please usethis form. December 2018 August 2017 March 2023 March 2023 March 2023 November 2021 April 2018 January 2017 November 2024 October 2024 August 2024 August 2024 August 2024 July 2024 May 2024 April 2024 February 2024 January 2024 December 2023 December 2023 October 2023 October 2023 November 2023 October 2023 October 2023 October 2023 September 2023 September 2023 August 2023 August 2023 August 2023 August 2023 August 2023 August 2023 August 2023 August 2023 July 2023 July 2023 June 2023 June 2023 June 2023 June 2023 June 2023 June 2023 June 2023 May 2023 May 2023 May 2023 May 2023 May 2023 May 2023 April 2023 April 2023 April 2023 April 2023 April 2023 April 2023 April 2023 April 2023 March 2023 March 2023 March 2023 March 2023 March 2023 August 2022 August 2022 April 2022 March 2022 November 2021 June 2021 April 2021 April 2021 January 2021 December 2020 December 2020 November 2020 April 2020 March 2020 December 2019 November 2019 November 2019 November 2019 November 2019 September 2019 August 2019 August 2019 August 2019 July 2019 July 2019 July 2019 June 2019 March 2019 January 2019 November 2018 September 2018 May 2018 April 2018 April 2018 March 2018 March 2017 February 2017 January 2017 October 2016 March 2016 March 2016 March 2016 November 2015 March 2015 December 2014 January 2014 March 2013 August 2012 December 2018 August 2017 April 2016 January 2015 July 2013 May 2013 April 2013 August 2012 January 2024 October 2023 September 2023 June 2023 May 2023 March 2023 March 2023 March 2023 March 2023 March 2023 August 2017 July 2017 May 2017 September 2016 December 2013 July 2013 June 2013 October 2005 October 2005 October 2005 April 2014 August 2012 January 2007 January 2005 Peter Attia is a physician focusing on the applied science of longevity. Δ Content Peter Connect Copyright © 2012–2024 PA IP, LLC. All rights reserved.This site is protected by reCAPTCHA and the GooglePrivacy PolicyandTerms of Serviceapply. Privacy Policy|Terms of Use|Do Not Share My Personal Information Login Sign-up (free) to receive the5 Tactics in my Longevity Toolkitdelivered by email as a 5-day course. Non-lame, weekly emails on the latest strategies and tactics for increasing your lifespan, healthspan, and well-being (plus new podcast announcements). Δ"
peterattiamd.com_newsletter.json,"Sign up to receive Peter's expertise in your inbox - Peter Attia Sign up to receive Peter’s expertise in your inbox Comment policy Introduction to My Longevity Tactics Sign up to receive the 5 tactics in my Longevity Toolkit, followed by non-lame, weekly emails on the latest strategies and tactics for increasing your lifespan, healthspan, and well-being (plus new podcast announcements). Email*HiddenH-o-n-e-y-p-o-tCAPTCHACommentsThis field is for validation purposes and should be left unchanged.Δ Δ Interested in past newsletters?View the full set of previous emails. Dr. Peter Attia, is a Stanford/Johns Hopkins/NIH-trained physician focusing on the applied science of longevity. His approach focuses on increasing lifespan (delaying the onset of chronic disease), while simultaneously improving healthspan (quality of life). Peter Attia is a physician focusing on the applied science of longevity. Δ Content Peter Connect Copyright © 2012–2024 PA IP, LLC. All rights reserved.This site is protected by reCAPTCHA and the GooglePrivacy PolicyandTerms of Serviceapply. Privacy Policy|Terms of Use|Do Not Share My Personal Information Login Sign-up (free) to receive the5 Tactics in my Longevity Toolkitdelivered by email as a 5-day course. Non-lame, weekly emails on the latest strategies and tactics for increasing your lifespan, healthspan, and well-being (plus new podcast announcements). Δ"
peterattiamd.com_outlive.json,"Outlive: The Science & Art of Longevity - New Book by Peter Attia Outlive The Science & Artof Longevity About the Authors Order Now Comment policy Rethinking Medicine to Live Better Longer DON’T MISS YOUR CHANCE FOR A SIGNED BOOKPLATE COPY OFOUTLIVE Introduction to My Longevity Tactics #1New York TimesBestseller AVAILABLE NOW Available everywhere books are sold A groundbreaking manifesto on living better and longer that challenges the conventional medical thinking on aging and reveals a new approach to preventing chronic disease and extending long-term health, from a visionary physician and leading longevity expert. “One of the most important books you’ll ever read.”—Steven D. Levitt,New York Timesbestselling author ofFreakonomics Wouldn’t you like to live longer? And better? In this operating manual for longevity, Dr. Peter Attia draws on the latest science to deliver innovative nutritional interventions, techniques for optimizing exercise and sleep, and tools for addressing emotional and mental health. For all its successes, mainstream medicine has failed to make much progress against the diseases of aging that kill most people: heart disease, cancer, Alzheimer’s disease, and type 2 diabetes. Too often, it intervenes with treatments too late to help, prolonging lifespan at the expense of healthspan, or quality of life. Dr. Attia believes we must replace this outdated framework with a personalized, proactive strategy for longevity, one where we take action now, rather than waiting. We have a limited number of signed copies of Outlive. Click the link below to order yours. Please note, they are only available to ship in the US. Dr. Peter Attia is my doctor and also my friend. He is a specialist in longevity and someone I trust with my life. What separates him from others is his pursuit of quality of life from all angles—physical, emotional, mental, relational, and spiritual health. This incredible book is a call to action and a reminder to always participate and never be passive. It will arm you with the tools you need to live a long, meaningful, and fulfilling life. Finally, there is a modern, thorough, clear, and actionable manual for how to maximize our immediate and long-term health. Firmly grounded in data and real-life conditions,Outlivemakes obvious which actions we all need to take and, just as important, what we all need to pay attention to in order to live a long, vital life. As the most accurate and comprehensive health guide published to date,Outliveis not just informative, it is important. InOutlive, Peter Attia has delivered the definitive look at the complex subject of longevity. Comprehensive and rigorous,Outliveis full of surprising insights into the diseases of aging that will likely kill most of us, and the tactics and techniques that can help us live longer and in better health. Attia’s writing surprises and delights us, while provoking a new way to think about longevity. Outlivea well-founded strategic and tactical approach to extending lifespan while also improving our physical, cognitive, and emotional health. Dr. Attia’s aim is less to tell youwhat to doand more to help you learnhow to thinkabout long-term health, in order to create the best plan for you as an individual. InOutlive, readers will discover: Aging and longevity are far more malleable than we think; our fate is not set in stone. With the right roadmap, you can plot a different path for your life, one that lets you outlive your genes to make each decade better than the one before. Peter Attia, MD, is the founder of Early Medical. He received his medical degree from the Stanford University School of Medicine and trained at the Johns Hopkins Hospital in general surgery. He also trained at the NIH as a surgical oncology fellow at the National Cancer Institute, where his research focused on immune-based therapies for melanoma. He serves on the editorial board for the journalAging. He is the host ofThe Drive, one of the most popular podcasts covering the topics of health, medicine, and longevity. Bill Gifford is a veteran journalist and author of theNew York TimesbestsellerSpring Chicken: Stay Young Forever (Or Die Trying). His work has appeared inOutside, Scientific American, Bloomberg Businessweek, Men’s Health,and numerous other publications. Outlivecompletely transformed my approach to growing old. Peter Attia is among the most brilliant people I’ve ever met, and he’s succeeded in packing a life’s worth of insights into this book. It promises to be one of the most important books you’ll ever read. InOutlive, Peter Attia explores the science of not just prolonging life, but also prolonging aliveness. Attia makes the crucial connection between overall health and relational health. Available everywhere books are sold Looking to Purchase internationally? Peter Attia is a physician focusing on the applied science of longevity. Δ Content Peter Connect Copyright © 2012–2024 PA IP, LLC. All rights reserved.This site is protected by reCAPTCHA and the GooglePrivacy PolicyandTerms of Serviceapply. Privacy Policy|Terms of Use|Do Not Share My Personal Information Login Sign-up (free) to receive the5 Tactics in my Longevity Toolkitdelivered by email as a 5-day course. Non-lame, weekly emails on the latest strategies and tactics for increasing your lifespan, healthspan, and well-being (plus new podcast announcements). Δ"
peterattiamd.com_podcast.json,"The Peter Attia Drive Podcast - Peter Attia The Peter Attia Drive Podcast Featured Podcasts #85 – Iñigo San Millán, Ph.D.: Zone 2 Training and Metabolic Health #47 – Matthew Walker, Ph.D., on sleep – Part I of III: Dangers of poor sleep, Alzheimer’s risk, mental health, memory consolidation, and more #87 – Rick Johnson, M.D.: Metabolic Effects of Fructose #202 – Peter on nutrition, disease prevention, sleep, and more — looking back on the last 100 episodes Recent Podcasts #324 ‒ Metabolism, energy balance, and aging: How diet, calorie restriction, and macronutrients influence longevity and metabolic health | Eric Ravussin, Ph.D. #323 – CRISPR and the future of gene editing: scientific advances, genetic therapies, disease treatment potential, and ethical considerations | Feng Zhang, Ph.D. #322 – Bone health for life: building strong bones, preventing age-related loss, and reversing osteoporosis with evidence-based exercise | Belinda Beck, Ph.D. #321 – Dopamine and addiction: navigating pleasure, pain, and the path to recovery | Anna Lembke, M.D. #320 – AMA 64: New insights on GLP-1 agonists (Ozempic, Wegovy, Mounjaro) – efficacy, benefits, risks, and considerations in the rapidly evolving weight-loss drug landscape #319 ‒ Peter’s key takeaways on liver health, heart rate variability, AI in medicine, klotho, and lactate metabolism | Quarterly Podcast Summary #2 #318 ‒ Cycling phenom and Tour de France champion Tadej Pogačar reveals his training strategies, on-bike nutrition, and future aspirations #317 ‒ Reforming medicine: uncovering blind spots, challenging the norm, and embracing innovation | Marty Makary, M.D., M.P.H. #316 – AMA #63: A guide for hair loss: causes, treatments, transplants, and sex-specific considerations #315 ‒ Life after near-death: a new perspective on living, dying, and the afterlife | Sebastian Junger Comment policy Sign up to receive the 5 tactics in my Longevity Toolkit, followed by non-lame, weekly emails on the latest strategies and tactics for increasing your lifespan, healthspan, and well-being (plus new podcast announcements). Introduction to My Longevity Tactics The Driveis hosted by Dr. Peter Attia, a Stanford/Johns Hopkins/NIH-trained physician focusing on the applied science of longevity, the extension of human life and well-being. Want to view all past podcasts on a single page?View our podcast archive. Want to view all past podcasts on a single page?View our podcast archive. Δ Peter Attia is a physician focusing on the applied science of longevity. Δ Content Peter Connect Copyright © 2012–2024 PA IP, LLC. All rights reserved.This site is protected by reCAPTCHA and the GooglePrivacy PolicyandTerms of Serviceapply. Privacy Policy|Terms of Use|Do Not Share My Personal Information Login Sign-up (free) to receive the5 Tactics in my Longevity Toolkitdelivered by email as a 5-day course. Non-lame, weekly emails on the latest strategies and tactics for increasing your lifespan, healthspan, and well-being (plus new podcast announcements). Δ"
peterattiamd.com_podcast_qualys.json,"The Qualys Podcast - Peter Attia The Qualys Podcast Featured Qualys How Alzheimer's disease is diagnosed My thoughts on alcohol consumption and health The 5 habits Tim Ferriss returns to most reliably The difference between glucose and fructose Comment policy In addition to The Qualys, subscribers also receive additional benefits: Introduction to My Longevity Tactics The Qualysis a subscriber-exclusive podcast, released Tuesday through Friday, and published exclusively on our private, subscriber-only podcast feed.Qualysis short-hand for “qualifying round,” which are typically the fastest laps driven in a race car—done before the race to determine starting position on the grid for race day.The Qualysare short (i.e., “fast”), typically less than ten minutes, and highlight the best questions, topics, and tactics discussed onThe Drive. Subscribe tothe Qualys A short intro from Peter about The Qualys #18 – Richard Isaacson, M.D.: Alzheimer’s prevention #04 – AMA #1: alcohol, best lab tests, wearables, finding the right doc, racing, and more #01 – Tim Ferriss: depression, psychedelics, and emotional resilience #14 – Robert Lustig, M.D., M.S.L.: fructose, processed food, NAFLD, and changing the food system Listen to more Qualys Access to members-only Ask Me Anything (AMA) podcasts and AMA forumYou get access to the back catalogue of AMA podcasts, and all future AMA episodes. You’ll also get the ability to participate by submitting your questions via the AMA page for possible future episodes. Full AMA episodes will be released through the members-only podcast feed. Comprehensive podcast show notesWe take extreme pride in detailing every topic, paper, person, and thing discussed in every episode of The Drive. This takes us a lot of time to produce, but there truly is no better way to take a deep dive into any of the topics we explore on the show. Exclusive discount codes for products we believe inI want my supporters to get the best deals out there on products I love. Although we do not take sponsorship money from anyone, we’re working closely with some products I love and buy myself to get exclusive members-only discounts. This allows us to take the money sponsors would have paid me, and pass that on as savings to you instead. Exclusive private podcast feedSubscribe to our members-only podcast feed in your favorite podcast player to get every episode of The Drive without the subscriber callout, plus full episodes of our monthly, members-only AMA podcasts, and other exclusive content. Subscribe Now Peter Attia is a physician focusing on the applied science of longevity. Δ Content Peter Connect Copyright © 2012–2024 PA IP, LLC. All rights reserved.This site is protected by reCAPTCHA and the GooglePrivacy PolicyandTerms of Serviceapply. Privacy Policy|Terms of Use|Do Not Share My Personal Information Login Sign-up (free) to receive the5 Tactics in my Longevity Toolkitdelivered by email as a 5-day course. Non-lame, weekly emails on the latest strategies and tactics for increasing your lifespan, healthspan, and well-being (plus new podcast announcements). Δ"
